,title,views,date
5,They call this drug eggs in Korea because these are so addictive!! 😳🥚🔥 Day 10 of Korean food,17076392,2024-01-10 17:53:07
7,Restaurant Style Chinese Broccoli | MyHealthyDish,15543745,2024-02-06 19:29:26
2,"These Yunnan dishes, passed down through generations, carry the flavors and warmth of home.",5194650,2024-08-14 04:00:14
1,Everyone should know how to make this classic,4696245,2024-02-01 10:50:27
4,Pad Kra Pao #recipe #cooking #padkrapao #shorts,1702406,2024-03-13 12:27:13
3,The Oldest Pork Fat Recipe in China | Most Satisfying Chinese Cooking,1247270,2024-08-16 03:30:11
8,BEST OF BEST CHINESE RECIPES foodiechina888 Compilation Vol.8,1176852,2024-01-20 04:00:11
10,Sesame Noodles #cooking #sesamenoodles #30minutemeals #shorts #dintaifung #recipe,1108791,2024-04-01 09:43:11
6,Hong Shao Rou #lowandslow #hongshaorou #redbraisedporkbelly #porkbelly #recipe #cooking #shorts,269965,2024-10-17 08:56:20
9,EASY CHINESE EGG PANCAKE RECIPE #recipe #cooking #chinesefood #egg #pancake #comfortfood,23742,2024-10-29 07:00:48
0,Easy Chinese Recipes You Can Make at Home  #cooking,602,2024-11-01 14:39:38
